{
  "$schema": "https://json-schema.org/draft/2020-12/schema",
  "$id": "https://suka-smart-assistant.local/schemas/catalog.schema.json",
  "title": "SSA Catalog Schema",
  "description": "Canonical schema for SSA catalog/index JSON files (e.g., breads.catalog.json). Supports minimal catalog entries (id + tags) while remaining forward-compatible for richer catalog metadata and items.",
  "type": "object",
  "required": ["schemaVersion", "meta", "items"],
  "additionalProperties": false,

  "properties": {
    "$schema": { "type": "string" },
    "$id": { "type": "string" },

    "schemaVersion": { "type": "string", "minLength": 1 },
    "updatedAt": { "type": "string", "format": "date-time" },

    "meta": { "$ref": "#/$defs/Meta" },

    "scope": {
      "description": "Optional scoping for planners/resolvers (e.g., 'breads', 'recipes', 'cuisines').",
      "type": ["string", "object"],
      "additionalProperties": true
    },

    "defaults": {
      "description": "Optional catalog defaults used by planners (e.g., default tags, filter hints).",
      "type": "object",
      "additionalProperties": true
    },

    "items": {
      "description": "Catalog entries (minimal or rich).",
      "type": "array",
      "minItems": 1,
      "items": { "$ref": "#/$defs/CatalogItem" }
    }
  },

  "$defs": {
    "Meta": {
      "type": "object",
      "required": ["id", "type", "name"],
      "additionalProperties": true,
      "properties": {
        "id": { "type": "string", "minLength": 1 },

        "type": {
          "description": "Catalog metadata type discriminator.",
          "type": "string",
          "const": "catalog"
        },

        "domain": {
          "description": "Domain/grouping. Keep permissive to support catalogs beyond recipes (e.g., equipment, lexicons).",
          "type": "string",
          "minLength": 1
        },

        "locale": { "type": "string", "minLength": 2 },

        "name": { "type": "string", "minLength": 1 },
        "label": {
          "description": "Optional human-friendly label; kept for compatibility with older data.",
          "type": "string"
        },
        "subtitle": { "type": "string" },

        "source": {
          "description": "Optional provenance block.",
          "type": ["object", "null"],
          "additionalProperties": true
        }
      }
    },

    "CatalogItem": {
      "description": "A single catalog entry. Minimal required is id + tags. Extra properties allowed for forward compatibility (paths, groups, search hints, nutrition tags, etc.).",
      "type": "object",
      "required": ["id", "tags"],
      "additionalProperties": true,
      "properties": {
        "id": {
          "description": "Canonical SSA ID, e.g. 'breads.focaccia_olive_oil'.",
          "type": "string",
          "minLength": 1
        },

        "tags": {
          "description": "Search/filter tags.",
          "type": "array",
          "items": { "type": "string", "minLength": 1 },
          "default": []
        },

        "path": {
          "description": "Optional relative path to the referenced JSON, if you want explicit linking.",
          "type": "string"
        },

        "label": {
          "description": "Optional display label (fallback if recipe meta.name not loaded).",
          "type": "string"
        },

        "group": {
          "description": "Optional grouping bucket for UI (e.g., 'sandwich loaves', 'artisan', 'quick breads').",
          "type": "string"
        },

        "rank": {
          "description": "Optional ordering hint. Lower numbers appear earlier.",
          "type": "number"
        },

        "status": {
          "description": "Optional lifecycle flag for catalog entries.",
          "type": "string",
          "enum": ["active", "draft", "deprecated"]
        },

        "notes": { "type": "string" },

        "refs": {
          "description": "Optional cross references (related IDs, aliases, etc.).",
          "type": "object",
          "additionalProperties": true
        }
      }
    }
  }
}
