{
  "$schema": "../../schemas/catalog.schema.json",
  "schemaVersion": "1.0.0",
  "updatedAt": "2026-01-24T00:00:00.000Z",
  "meta": {
    "id": "farm_to_table.plate_templates",
    "type": "catalog",
    "domain": "farm-to-table",
    "locale": "en-US",
    "name": "Farm-to-Table • Plate Templates Catalog",
    "label": "Plate Templates",
    "subtitle": "Deterministic plate-model templates used by planners to assemble balanced meals using farm-to-table components and roles.",
    "source": {
      "kind": "catalog",
      "name": "src/catalogs/farm-to-table/plate_templates.catalog.json",
      "notes": [
        "Templates define roles, required slots, and common pairings; planners resolve to actual components via inventory, cuisine rulesets, and substitutions.",
        "Portioning is expressed as flexible hints (not strict nutrition). Nutrition modules can override with macro targets.",
        "Use plannerTags to bias search (weeknight/batch/leftovers/etc.)."
      ]
    }
  },
  "scope": {
    "kind": "module",
    "module": "farm-to-table",
    "locale": "en-US"
  },
  "defaults": {
    "namespace": "plate",
    "statusDefault": "active",
    "ui": {
      "sortBy": "rank",
      "groupBy": "group"
    },
    "engineHints": {
      "slotFillOrder": [
        "protein",
        "starch",
        "vegetable",
        "sauce",
        "fresh_element",
        "garnish",
        "drink"
      ],
      "readinessBias": {
        "weeknight": [
          "readiness.prepped",
          "readiness.parcooked",
          "readiness.cooked",
          "readiness.preserved_shelf_stable",
          "readiness.preserved_frozen"
        ],
        "batchDay": [
          "readiness.raw",
          "readiness.cleaned",
          "readiness.trimmed",
          "readiness.chopped",
          "readiness.marinated"
        ]
      }
    }
  },
  "items": [
    {
      "id": "plate.template.core_balanced",
      "label": "Core Balanced Plate",
      "group": "Core",
      "rank": 10,
      "status": "active",
      "tags": [
        "plate.template",
        "plate.balanced",
        "planner.core",
        "weeknight.friendly",
        "batch.friendly"
      ],
      "refs": {
        "templateVersion": "1.0",
        "slots": [
          {
            "id": "protein",
            "label": "Protein",
            "role": "role.protein",
            "required": true,
            "choose": 1,
            "portionHint": "Palm-size portion (or per macro target).",
            "preferredReadiness": [
              "readiness.prepped",
              "readiness.marinated",
              "readiness.parcooked",
              "readiness.cooked"
            ]
          },
          {
            "id": "veg_primary",
            "label": "Vegetable (Primary)",
            "role": "role.vegetable",
            "required": true,
            "choose": 1,
            "portionHint": "1–2 fists of vegetables (raw or cooked).",
            "preferredReadiness": [
              "readiness.chopped",
              "readiness.prepped",
              "readiness.parcooked",
              "readiness.cooked"
            ]
          },
          {
            "id": "starch",
            "label": "Starch / Grain / Root",
            "role": "role.starch",
            "required": false,
            "choose": 1,
            "portionHint": "1 cupped-hand starch (optional; adjust for activity goals).",
            "preferredReadiness": [
              "readiness.parcooked",
              "readiness.cooked",
              "readiness.preserved_shelf_stable"
            ]
          },
          {
            "id": "fat",
            "label": "Fat (Cooking or Finishing)",
            "role": "role.fat",
            "required": false,
            "choose": 1,
            "portionHint": "1–2 thumbs fat (oil, butter, avocado, nuts).",
            "preferredReadiness": [
              "readiness.preserved_shelf_stable",
              "readiness.prepped"
            ]
          },
          {
            "id": "acid",
            "label": "Acid / Brightener",
            "role": "role.acid",
            "required": false,
            "choose": 1,
            "portionHint": "A squeeze/splash for balance.",
            "preferredReadiness": [
              "readiness.prepped",
              "readiness.preserved_shelf_stable"
            ]
          },
          {
            "id": "sauce",
            "label": "Sauce / Dressing",
            "role": "role.sauce",
            "required": false,
            "choose": 1,
            "portionHint": "1–3 tbsp (optional).",
            "preferredReadiness": [
              "readiness.prepped",
              "readiness.cooked",
              "readiness.preserved_shelf_stable"
            ]
          },
          {
            "id": "garnish",
            "label": "Garnish / Herb",
            "role": "role.garnish",
            "required": false,
            "choose": 1,
            "portionHint": "A pinch/handful for aroma and finish.",
            "preferredReadiness": [
              "readiness.cleaned",
              "readiness.prepped",
              "readiness.preserved_shelf_stable"
            ]
          }
        ],
        "pairingHints": {
          "protein_to_sauce": [
            {
              "proteinTag": "protein.chicken",
              "sauceTags": [
                "sauce.garlic",
                "sauce.lemon",
                "sauce.yogurt",
                "sauce.bbq"
              ]
            },
            {
              "proteinTag": "protein.beef",
              "sauceTags": [
                "sauce.pan_gravy",
                "sauce.chimichurri",
                "sauce.pepper",
                "sauce.tomato"
              ]
            },
            {
              "proteinTag": "protein.fish",
              "sauceTags": [
                "sauce.lemon",
                "sauce.tartar",
                "sauce.herb",
                "sauce.cream"
              ]
            }
          ],
          "starch_to_protein": [
            {
              "starchTag": "starch.rice",
              "proteinTags": [
                "protein.chicken",
                "protein.beef",
                "protein.fish",
                "protein.lamb",
                "protein.goat"
              ]
            },
            {
              "starchTag": "starch.potato",
              "proteinTags": [
                "protein.beef",
                "protein.pork",
                "protein.chicken",
                "protein.fish"
              ]
            }
          ]
        },
        "plannerTags": [
          "plate.core",
          "plate.flexible",
          "meal.dinner",
          "meal.lunch"
        ]
      }
    },

    {
      "id": "plate.template.bowl_grain_bowl",
      "label": "Grain Bowl / Power Bowl",
      "group": "Bowls",
      "rank": 20,
      "status": "active",
      "tags": [
        "plate.template",
        "plate.bowl",
        "meal.lunch",
        "meal.dinner",
        "batch.friendly"
      ],
      "refs": {
        "templateVersion": "1.0",
        "slots": [
          {
            "id": "base_starch",
            "label": "Base (Grain/Root)",
            "role": "role.starch",
            "required": true,
            "choose": 1,
            "portionHint": "1–2 cups cooked grain/root (or per targets).",
            "preferredReadiness": [
              "readiness.cooked",
              "readiness.parcooked",
              "readiness.preserved_shelf_stable"
            ]
          },
          {
            "id": "protein",
            "label": "Protein",
            "role": "role.protein",
            "required": true,
            "choose": 1,
            "portionHint": "Palm-size portion.",
            "preferredReadiness": [
              "readiness.cooked",
              "readiness.prepped",
              "readiness.marinated"
            ]
          },
          {
            "id": "veg_mix",
            "label": "Vegetables (2+)",
            "role": "role.vegetable",
            "required": true,
            "choose": 2,
            "portionHint": "2+ cups mixed veg (roasted + fresh works best).",
            "preferredReadiness": [
              "readiness.chopped",
              "readiness.cooked",
              "readiness.prepped"
            ]
          },
          {
            "id": "sauce",
            "label": "Sauce / Dressing",
            "role": "role.sauce",
            "required": true,
            "choose": 1,
            "portionHint": "2–4 tbsp.",
            "preferredReadiness": [
              "readiness.prepped",
              "readiness.preserved_shelf_stable",
              "readiness.cooked"
            ]
          },
          {
            "id": "crunch",
            "label": "Crunch (Nuts/Seeds/Croutons)",
            "role": "role.crunch",
            "required": false,
            "choose": 1,
            "portionHint": "1–2 tbsp.",
            "preferredReadiness": ["readiness.preserved_shelf_stable"]
          },
          {
            "id": "acid",
            "label": "Acid / Pickle",
            "role": "role.acid",
            "required": false,
            "choose": 1,
            "portionHint": "Pickled veg or squeeze of citrus.",
            "preferredReadiness": [
              "readiness.preserved_shelf_stable",
              "readiness.prepped"
            ]
          }
        ],
        "plannerTags": [
          "plate.bowl",
          "plate.batchable",
          "leftovers.good",
          "weeknight.friendly"
        ]
      }
    },

    {
      "id": "plate.template.salad_meal",
      "label": "Meal Salad (Protein Salad)",
      "group": "Salads",
      "rank": 30,
      "status": "active",
      "tags": [
        "plate.template",
        "plate.salad",
        "meal.lunch",
        "weeknight.friendly"
      ],
      "refs": {
        "templateVersion": "1.0",
        "slots": [
          {